{
  "$schema": "./docs/lingcoo-system.schema.json",
  "name": "lingcoo-official-website-system",
  "displayName": "Lingcoo Official Website System",
  "frame": {
    "version": "0.1.0",
    "commit": "9aa93e3"
  },
  "surfaces": ["api", "worker", "admin-ui", "public-web"],
  "foundationModules": [
    "system",
    "settings",
    "presentation",
    "auth",
    "cms",
    "public-site",
    "access",
    "audit",
    "metadata",
    "data-exchange",
    "search",
    "observability",
    "integrations",
    "assets",
    "jobs",
    "notifications"
  ],
  "domainModules": ["inquiries"]
}
